{
  "id": "f-yeongjong-2025",
  "eventId": "e-yeongjong-fireworks-2025",
  "asOf": "2025-10-04",
  "createdAt": "2026-09-24T20:00:00+09:00",
  "modelVersion": "v0.1.0",
  "dailyMean": {
    "id": "q-f-yeongjong-2025-mean",
    "name": "일평균 방문객",
    "value": null,
    "p10": 7400,
    "p50": 13000,
    "p90": 22000,
    "unit": "명/일",
    "timeUnit": "일",
    "spatialScope": "행사장",
    "kind": "예측",
    "estimated": false,
    "assumptionIds": []
  },
  "peakConcurrent": {
    "id": "q-f-yeongjong-2025-peak",
    "name": "순간 최대",
    "value": null,
    "p10": 12000,
    "p50": 21000,
    "p90": 35000,
    "unit": "명",
    "timeUnit": "순간",
    "spatialScope": "행사장",
    "kind": "예측",
    "estimated": true,
    "assumptionIds": [
      "as-peak-day-factor",
      "as-concurrency-fireworks"
    ]
  },
  "probabilities": [
    {
      "threshold": 1000,
      "probability": 0.99,
      "display": "99%"
    },
    {
      "threshold": 5000,
      "probability": 0.9,
      "display": "90%"
    }
  ],
  "peakHours": {
    "from": "19:00",
    "to": "21:00"
  },
  "hourlyProfile": [
    {
      "hour": 17,
      "share": 0.1
    },
    {
      "hour": 18,
      "share": 0.2
    },
    {
      "hour": 19,
      "share": 0.35
    },
    {
      "hour": 20,
      "share": 0.25
    },
    {
      "hour": 21,
      "share": 0.1
    }
  ],
  "composition": null,
  "judgment": {
    "level": 4,
    "label": "대규모",
    "reasons": [
      {
        "ruleId": "rule-legal-hazard",
        "kind": "법정",
        "text": "폭죽 사용 — 법정 기준(인원 무관)",
        "clauseId": "law-disaster-act-enf-73-9",
        "evidenceId": "ev-rule-legal-hazard"
      },
      {
        "ruleId": "rule-internal-5000",
        "kind": "자체",
        "text": "5,000명 초과 90% — 자체 기준",
        "clauseId": null,
        "evidenceId": "ev-model-v0-1"
      }
    ],
    "checklist": [
      {
        "id": "ck-traffic",
        "text": "교통·주차 통제 계획과 경찰·소방 사전 협의",
        "ruleId": "rule-internal-5000",
        "evidenceIds": [
          "ev-model-v0-1"
        ]
      }
    ]
  },
  "factors": [
    {
      "id": "fa-night-weekend",
      "feature": "토요일·야간",
      "direction": "up",
      "contribution": 0.42,
      "label": "토요일 저녁 개최라 늘어요",
      "evidenceIds": [
        "ev-model-v0-1"
      ]
    }
  ],
  "ood": false,
  "oodReasons": [],
  "predictionRun": {
    "id": "pr-f-yeongjong-2025",
    "modelVersion": "v0.1.0",
    "asOf": "2025-10-04",
    "observationIds": [
      "obs-28110-sat-nonlocal"
    ],
    "trainRange": {
      "from": "2018-01-01",
      "to": "2024-12-31"
    }
  },
  "observations": [
    {
      "id": "obs-28110-sat-nonlocal",
      "featureName": "평시 토요일 외지인",
      "value": 61000,
      "unit": "명/일",
      "datasetId": "ds-kto-visitors-15101972",
      "observedAt": "2025-09-27",
      "availableAt": "2025-10-01",
      "sigunguCode": "28110"
    }
  ],
  "evidence": [
    {
      "id": "ev-baseline-28110",
      "kind": "data",
      "title": "인천 중구 평시 토요일 방문",
      "summary": "행사 전 4주 같은 요일 평균",
      "quantityIds": [],
      "source": {
        "datasetId": "ds-kto-visitors-15101972",
        "title": "한국관광공사_빅데이터_지역별 방문자수_GW",
        "publisher": "한국관광공사",
        "datalabMenu": "빅데이터 > 지역별 방문자수(이동통신)",
        "accessUrl": "https://www.data.go.kr/data/15101972/openapi.do"
      },
      "availableAt": "2025-09-30",
      "ruleId": null,
      "clauseId": null,
      "caseEventId": null,
      "assumptionId": null,
      "modelVersion": null,
      "check": null
    },
    {
      "id": "ev-model-v0-1",
      "kind": "model",
      "title": "예측 모델",
      "summary": "LightGBM 분위수 + CQR",
      "quantityIds": [
        "q-f-yeongjong-2025-mean"
      ],
      "source": null,
      "availableAt": null,
      "ruleId": null,
      "clauseId": null,
      "caseEventId": null,
      "assumptionId": null,
      "modelVersion": "v0.1.0",
      "check": null
    },
    {
      "id": "ev-rule-legal-hazard",
      "kind": "rule",
      "title": "인원 무관 대상(폭죽)",
      "summary": "불·폭죽 사용 행사는 인원과 관계없이 안전관리계획 수립 대상",
      "quantityIds": [],
      "source": null,
      "availableAt": null,
      "ruleId": "rule-legal-hazard",
      "clauseId": "law-disaster-act-enf-73-9",
      "caseEventId": null,
      "assumptionId": null,
      "modelVersion": null,
      "check": null
    },
    {
      "id": "ev-assumption-concurrency-fireworks",
      "kind": "assumption",
      "title": "동시체류율(불꽃)",
      "summary": "불꽃 행사 동시체류율 1.0(범위 0.8~1.0, 가정)",
      "quantityIds": [
        "q-f-yeongjong-2025-peak"
      ],
      "source": null,
      "availableAt": null,
      "ruleId": null,
      "clauseId": null,
      "caseEventId": null,
      "assumptionId": "as-concurrency-fireworks",
      "modelVersion": null,
      "check": null
    }
  ]
}
